SI,Title,Type,Authors,ISBN,ISBN13,Publication Year,Publisher,Category,Call No,Location,Subject,Series,Edition,Year,Description,Tags,Num Pages,Place
TKU7WJVS,The dictionary of world myth,Books,0,0-8160-3300-5,,1995,Facts on File,,General Reference,New York,Dictionaries; Mythology,,,1995,,,240,
JBF23VNF,Photographers: history and culture through the camera,Books,"Jackson, Nancy",0-8160-3358-7,,1997,Facts on File,,PHOTOGRAPHY,New York,"United States; Documentary photography; Photography, Artistic; Photographers; Biography Juvenile literature; History Juvenile literature",American profiles,,1997,,,134,
NMLUPQRY,Innovative furniture in America from 1800 to the present: exhibition,Books,"Hanks, David A.; Roth, Rodris; Talbott, Page; Cooper-Hewitt Museum",0-8180-0450-9,,1981,Horizon Press,,DECORATIVE ARTS,New York,History; United States; Furniture,,,1981,,,200,
445TX9AS,Artists in photographs,Books,"Mones, Arthur; Carnegie Institute",0-8180-1423-7,,1981,"Horizon Press in association with the Museum of Art, Carnegie Institute",,ARTIST - M,New York,"Artists; Portraits Exhibitions; Mones, Arthur",,,1981,,,79,
9CBY9URR,Klee as in clay: a pronunciation guide,Books,"McConkey, Wilfred J.",0-8191-5620-5,,1986,Hamilton Press,,NX163 .M3 1986,"Lanham, MD",Artists; Registers; Names; Pronunciation,,,1986,,,61,
5EPMBQES,Klee as in clay: a pronunciation guide,Books,"McConkey, Wilfred J.",0-8191-5620-5,,1986,Hamilton Press,,General Reference,"Lanham, MD",Artists; Registers; Names; Pronunciation,,,1986,,,61,
A9G4M8YA,"The Christmas crèche: treasure of faith, art & theater",Books,"Powell, Matthew",0-8198-1544-6,,1997,Pauline Books & Media,,GENERAL HISTORY,Boston,Christian art and symbolism; Crèches (Nativity scenes),,,1997,,,156,
N2EN47AZ,Winslow Homer,Books,"Homer, Winslow; Goodrich, Lloyd; Art Institute of Chicago; Los Angeles County Museum of Art; Whitney",0-8212-0527-7,,1973,,,ARTIST - H,[New York?,"Homer, Winslow",,,1973,,,143,
967R58AK,Masterpieces of Chinese Art,Books,"Hay, John",0-8212-0575-7,,1974,Phaidon Press,,CHINESE,,0,,,1974,,,,
HRJW43IU,The portfolios of Ansel Adams,Books,"Adams, Ansel",0-8212-0723-7,,1977,New York Graphic Society,,ARTIST - A,Boston,"Photography, Artistic; Adams, Ansel",,,1977,,,124,
EGFDKH7B,American Impressionism,Books,"Boyle, Richard J.",0-8212-1500-0,,1982,,,IMPRESSIONISM-B,,0,,,1982,,,,
LDRCJBKW,El Greco of Toledo,Books,"Greco; Brown, Jonathan; Toledo Museum of Art",0-8212-1501-9,,1982,"Little, Brown",,ARTIST - E,Boston,Exhibitions; Greco,,1st ed,1982,,,275,
W4B4CV27,Examples: the making of 40 photographs,Books,"Adams, Ansel",0-8212-1551-5,,1983,"Little, Brown",,ARTIST - A,Boston,"Photography, Artistic; Adams, Ansel",,1st ed,1983,,,177,
4TNW9P28,Women artists and the surrealist movement,Books,"Chadwick, Whitney",0-8212-1599-X,,1985,"Little, Brown",,MODERN,"Boston, Mass",Women artists; Surrealism; Feminism and the arts; Psychology,,1st U.S. ed,1985,,,256,
22CAYSNV,Supreme instants: the photography of Edward Weston,Books,"Weston, Edward; Newhall, Beaumont; University of Arizona",0-8212-1621-X,,1986,"Little, Brown",,ARTIST - W,Boston,"Photography, Artistic; Weston, Edward",,1st ed,1986,,,191,
ZREDZN5Q,"Georgia O'Keeffe, art and letters",Books,"O'Keeffe, Georgia; Cowart, Jack; Hamilton, Juan; National Gallery of Art (U.S.)",0-8212-1686-4,,1987,National Gallery of Art ; New York Graphic Society Books,,ARTIST - O,Washington : Boston,"Exhibitions; United States; Artists; O'Keeffe, Georgia; Correspondence",,,1987,,,306,
CNJ69CCY,The Art of Paul Gauguin,Books,0,0-8212-1723-2,,1988,National Gallery of Art,,ARTIST - G,Washington,"Exhibitions; Gauguin, Paul",,,1988,,,519,
ECL6375K,Treasures of American folk art from the Abby Aldrich Rockefeller Folk Art Center,Books,0,0-8212-1726-7,,1989,"Little, Brown in association with the Colonial Williamsburg Foundation",,AMERICAN,Boston,United States; Folk art; Abby Aldrich Rockefeller Folk Art Center; Virginia Williamsburg,,1st ed,1989,,,223,
5NZCBJU9,"Monet by Himself: Paintings, Drawings, Pastels, Letters",Books,"Kendall, Richard",0-8212-1766-6,,1990,"Little, Brown and Company",,ARTIST - M,,0,,,1990,,,,
ZDEQMGKW,"Henri Cartier Bresson, photographer",Books,"Cartier-Bresson, Henri",0-8212-1986-3,,1992,"Little, Brown",,ARTIST - C,Boston,"Photography, Artistic; Cartier-Bresson, Henri",,1st rev. ed,1992,,,343,
5MHGTYJX,Pronunciation dictionary of artists' names,Books,"Edelstein, Debra; Kaltenbach, G. E.; Art Institute of Chicago",0-8212-2025-X,,1993,"Little, Brown",,General Reference,Boston,"Artists; Names, Personal; Pronunciation Dictionaries; Registers",,3rd rev. ed,1993,,,1,
68JHN7J7,National Museum of American Art,Books,0,0-8212-2216-3,,1995,The Museum,,AMERICAN,"Washington, D.C.","Art; Washington (D.C.); Catalogs; Art, American; National Museum of American Art (U.S.)",,,1995,,,279,
EXLP6AXD,Margaret Bourke-White: photographer,Books,"Bourke-White, Margaret; Callahan, Sean",0-8212-2490-5,,1998,"Little, Brown",,ARTIST-B,Boston,"Bourke-White, Margaret; Documentary photography; Photography, Industrial; United States",,1st ed,1998,,,158,
T2P284Q8,"""The Art that is Life"": The Arts & Crafts Movement in America, 1875-1920",Books,"Kaplan, Wendy",0-8212-2554-5,,1987,"Little, Brown and Company",,DECORATIVE ARTS,,0,,,1987,,,,
RSELSU7T,"The Art That Is Life: The Arts and Crafts Movement in America, 1875-1920",Books,Wendy Kaplan,0-8212-2554-5,,1998,Museum of Fine Arts Boston,,American,,0,,,1998,,,,
VVIT5SBL,Chandeliers,Books,"Hilliard, Elizabeth",0-8212-2768-8,,2001,"Little, Brown",,DECORATIVE ARTS,Boston,History; Chandeliers,,1st U.S. ed,2001,,,208,
CF6PTZNP,The photography of Charles Sheeler: American modernist,Books,"Stebbins, Theodore E.; Haas, Karen; Mora, Gilles; Sheeler, Charles; Museum of Fine Arts, Boston",0-8212-2812-9,,2002,Bulfinch Press,,ARTIST - S OVERSIZE,Boston,"Exhibitions; Photography, Artistic; Sheeler, Charles",,1st American ed,2002,,,224,
IJZAGECB,Global/local: cultural production and the transnational imaginary,Books,0,0-8223-1702-8,,1996,Duke University Press,,MODERN,Durham,Civilization; Asia; Intercultural communication; Pacific Area; Regionalism,"Asia-Pacific : culture, politics, and society",,1996,,,399,
82DIKSA7,"John Kane, painter",Books,"Arkus, Leon Anthony; McSwigan, Marie; Arkus, Leon Anthony; Kane, John",0-8229-3217-2,,1971,University of Pittsburgh Press,,Artist K,Pittsburgh,"Kane, John",,,1971,,,343,
C3GJF7K4,Out of this furnace,Books,"Bell, Thomas",0-8229-3321-7,,1976,University of Pittsburgh Press,,GENERAL CMoA/PGH,Pittsburgh,History; Fiction; Autobiographical fiction; Braddock (Pa.); Pennsylvania Braddock; Slovaks; Steel industry and trade,Pitt paperback ; 120,,1976,,,424,
NTB6D59P,Discovering Pittsburgh's sculpture,Books,"Gay, Vernon; Evert, Marilyn",0-8229-3467-1,,1983,University of Pittsburgh Press,,General CMOA/Pgh,"Pittsburgh, Pa","Pennsylvania Pittsburgh; Buildings, structures, etc; Sculpture, American; Pittsburgh (Pa.); Monuments; Statues",,,1983,,,451,
R9IF7FWG,A guidebook to historic western Pennsylvania,Books,"Smith, Helene; Swetnam, George",0-8229-3630-5,,1991,University of Pittsburgh Press,,ARCHITECTURE,"Pittsburgh, Pa",Pennsylvania; Historic sites; Guidebooks,,"2nd ed., rev. and enlarged",1991,,,410,
S84DQ6FX,"The early architecture of western Pennsylvania: a record of building before 1860 based upon the western Pennsylvania architectural survey, a project of the Pittsburgh chapter of the American Institute of Architects with an introduction by Fiske Kimball",Books,"Stotz, Charles Morse; American Institute of Architects",0-8229-3787-5,,1995,University of Pittsburgh Press,,ARCHITECTURE,Pittsburgh,"19th century; Pennsylvania; 18th century; Architecture; 17th century; Architecture, Modern",,,1995,,,296,
D5TWVDXK,Andrew Carnegie,Books,"Wall, Joseph Frazier",0-8229-3828-6,,1989,University of Pittsburgh Press,,GENERAL CMoA/PGH,"Pittsburgh, Pa","Biography; United States; Steel industry and trade; Carnegie, Andrew; Industrialists; Philanthropists",,2nd ed.,1989,,,1137,
L82UV98T,"Pittsburgh, then and now",Books,"Smith, Arthur G.",0-8229-3830-8,,1990,University of Pittsburgh Press,,ARCHITECTURE,"Pittsburgh, Pa",Pictorial works; History Pictorial works; Pittsburgh (Pa.),,,1990,,,325,
25R7SAQ2,Seeing Pittsburgh,Books,"Fifield, Barringer",0-8229-3859-6,,1996,University of Pittsburgh Press,,GENERAL CMoA/PGH,"Pittsburgh, Pa",Pictorial works; Pittsburgh (Pa.); Tours,,,1996,,,288,
XDMLTK4B,A wise extravagance: the founding of the Carnegie International exhibitions 1895-1901,Books,"Neal, Kenneth",0-8229-3925-8,,1996,University of Pittsburgh Press,,GENERAL CMoA/PGH,Pittsburgh,"History; Exhibitions; 20th century; Art, Modern; Museum of Art; Carnegie Institute; Carnegie International",,,1996,,,273,
9294N2JY,"Luke Swank, modernist photographer",Books,"Bossen, Howard; Swank, Luke",0-8229-4253-4,,2005,University of Pittsburgh Press,,ARTIST - S,"Pittsburgh, Pa","Biography; Pennsylvania; Photographers; Swank, Luke",,,2005,,,236,
9S4BTWMS,Palace of culture: Andrew Carnegie's museums and library in Pittsburgh,Books,"Gangewere, Robert J.",0-8229-4397-2,,2011,University of Pittsburgh Press,,NON-CIRCULATING (DO NOT REMOVE FROM DER),"Pittsburgh, Pa","History; 20th century; Intellectual life; Pittsburgh (Pa.); Carnegie, Andrew; Carnegie Library of Pittsburgh",,,2011,,,332,
5KW4X3MV,"Teenie Harris, photographer: image, memory, history",Books,"Finley, Cheryl; Glasco, Laurence Admiral; Harris, Teenie; Trotter, Joe William",0-8229-4414-6,,2011,University of Pittsburgh Press : published in cooperation with Carnegie Museum of Art,,ARTIST - H,Pittsburgh,"Biography; United States; Criticism and interpretation; Photographers; African American art; African American photographers; African Americans; Harris, Teenie; Pennsylvania Pittsburgh; Pictorial works",,,2011,,,192,
SR88I29G,"Teenie Harris, photographer: image, memory, history",Books,"Finley, Cheryl; Glasco, Laurence Admiral; Harris, Teenie; Trotter, Joe William",0-8229-4414-6,,2011,University of Pittsburgh Press : published in cooperation with Carnegie Museum of Art,,NON-CIRCULATING REFERENCE,Pittsburgh,"Biography; United States; Criticism and interpretation; Photographers; African American art; African American photographers; African Americans; Harris, Teenie; Pennsylvania Pittsburgh; Pictorial works",,,2011,,,192,
EANMRRI8,Thaddeus Mosley: African-American Sculptor,Books,"Lewis, David",0-8229-5634-9,,1997,Carnegie Museum of Art,,ARTIST - M,,0,,,1997,,,,
632DRYGK,The American impressionists,Books,"Hoopes, Donelson F.",0-8230-0212-8,,1972,Watson-Guptill Publications,,IMPRESSIONISM-H,New York,"19th century; Impressionism (Art); Painting, American; United States",,,1972,,,159,
9BUNNYBL,"American realists, Homer to Hopper",Books,"Young, Mahonri Sharp",0-8230-0215-2,,1977,Watson-Guptill Publications,,AMERICAN,New York,"19th century; 20th century; Biography; Painters; Painting, American; United States; Realism in art",,,1977,,,208,
BDGQZCFJ,American watercolor painting,Books,"Hoopes, Donelson F.",0-8230-0216-0,,1977,Watson-Guptill Publications,,AMERICAN,New York,"United States; Watercolor painting, American; Watercolorists",,,1977,,,208,
BKEJBGUU,"The big book of ceramics: a guide to the history, materials, equipment, and techniques of hand-building, molding, throwing, kiln-firing, and glazing pottery and other ceramic objects",Books,"Chavarría, Joaquim",0-8230-0508-9,,1994,Watson-Guptill,,DECORATIVE ARTS,New York,Technique; Pottery,,,1994,,,192,
8T87QIBN,John Twachtman,Books,"Twachtman, John Henry; Boyle, Richard J.",0-8230-2569-1,,1979,Watson Guptill,,ARTIST - T,New York,"Biography; Painters; United States; Twachtman, John Henry",,,1979,,,88,
P34URTLE,The regionalists,Books,"Heller, Nancy; Williams, Julia",0-8230-4516-1,,1976,Watson-Guptill Publications,,AMERICAN,New York,"In art; 20th century; Painting, American; United States; Art, Regional",,,1976,,,208,
ZKGHFY66,Art and identity in Oceania,Books,0,0-8248-1304-9,,1990,University of Hawaii Press,,ASIAN,Honolulu,Art; Art and society; Congresses; Oceania,,,1990,,,315,
JM3XJ6VV,"Painters of the humble truth: masterpieces of American still life, 1801-1939",Books,"Gerdts, William H.; Gerdts, William H.; Philbrook Art Center",0-8262-0355-8,,1981,University of Missouri Press ; Philbrook Art Center,,AMERICAN,"Columbia, Mo. : [Tulsa, Okla.]","Exhibitions; Still-life painting, American",,,1981,,,293,
6N9S7PI4,"Between home and heaven: contemporary American landscape photography from the Consolidated Natural Gas Company Collection of the National Museum of American Art, Smithsonian Institution",Books,0,0-8263-1363-9,,1992,"National Museum of American Art, Smithsonian Institution in association with the University of New Mexico Press, Albuquerque, N.M",,PHOTOGRAPHY,"Washington, D.C",Exhibitions; United States; National Museum of American Art (U.S.); Landscape photography,,,1992,,,176,
ZNHIHDMZ,The Encyclopedia of ancient civilizations,Books,0,0-8317-2790-X,,1980,Mayflower Books,,ANCIENT,New York,"Civilization, Ancient; Dictionaries",,,1980,,,367,
VIB6HA3K,Impressionism,Books,"Thomson, Belinda; Howard, Michael",0-8317-4868-0,,1993,Smithmark Publishers,,IMPRESSIONISM-H,New York,"19th century; France; Impressionism (Art); Painting, French",,,1993,,,192,
P66YN4R6,Shakespeare in American painting: a catalogue from the late Eighteenth Century to the present,Books,"Studing, Richard",0-8386-3408-7,,1993,Fairleigh Dickinson University Press ; Associated University Presses,,AMERICAN,Rutherford [N.J.] : London,"Painting, American; United States; Catalogs; Shakespeare, William; Appreciation; Art and literature; Illustrations Catalogs",,,1993,,,170,
8FWSGACL,Drawing,Books,"Monnier, Geneviève; Leymarie, Jean; Rose, Bernice",0-8478-0239-6,,1979,Skira ; Rizzoli,,GENERAL HISTORY,Geneva : New York,Drawing,History of an art,,1979,,,279,
8IN35JRX,Art in the ancient world: a handbook of styles and forms,Books,0,0-8478-0370-8,,1981,Rizzoli,,ANCIENT,New York,"Antiquities; Art, Ancient; Art, Classical; Art, Egyptian; Middle East",,,1981,,,567,
LNNAINMJ,Sir Edwin Landseer,Books,"Ormond, Richard; Hamlyn, Robin; Landseer, Edwin; Rishel, Joseph J.; Philadelphia Museum of Art; Tate",0-8478-0390-2,,1981,Rizzoli,,Artist L,New York,"Exhibitions; Landseer, Edwin",,,1981,,,223,
L8YTTWZD,Prints: history of an art,Books,0,0-8478-0392-9,,1981,Skira ; Rizzoli,,MEDIEVAL,Geneva : New York,History; Prints,,,1981,,,278,
4C6SB2LB,"Art of the Christian world, A.D. 200-1500: a handbook of styles and forms",Books,0,0-8478-0426-7,,1982,Rizzoli,,MEDIEVAL,New York,"Themes, motives; Christian art and symbolism; Medieval, 500-1500; To 500",,,1982,,,504,
QNCPU7GK,Marcel Broodthaers,Books,"Broodthaers, Marcel; Compton, Michael; Goldwater, Marge; Walker Art Center",0-8478-1051-8,,1989,Walker Art Center ; Rizzoli,,ARTIST-B,Minneapolis : New York,"Broodthaers, Marcel; Exhibitions",,,1989,,,223,
FE6BIP3P,Titian drawings,Books,"Titian; Chiari Moretto Wiel, M. Agnese",0-8478-1246-4,,1990,Rizzoli,,ARTIST - T OVERSIZE,New York,Catalogues raisonnés; Titian,,,1990,,,105,
HMJBZIKA,Women in architecture: a contemporary perspective,Books,"Lorenz, Clare",0-8478-1277-4,,1990,Rizzoli,,ARCHITECTURE,New York,"20th century; Biography History and criticism; Architecture, Modern; Women architects",,,1990,,,144,
KNGH3H2Y,Ben Nicholson,Books,"Lewison, Jeremy; Nicholson, Ben",0-8478-1395-9,,1991,Rizzoli International,,ARTIST - N,New York,"Catalogs; Nicholson, Ben",,,1991,,,128,
WFM7HLXI,The loves of the gods: mythological painting from Watteau to David,Books,"Bailey, Colin B.; Hamilton, Carrie A.; Galeries nationales du Grand Palais (France); Kimbell Art Mus",0-8478-1521-8,,1992,Rizzoli ; Kimbell Art Museum,,Religion/Myth,New York : Fort Worth,"Painting, French; Exhibitions; 18th century; Mythology, Classical, in art",,,1992,,,587,
8IQ57UA5,A weekend with Winslow Homer,Books,"Beneduce, Ann Keay",0-8478-1622-2,,1993,Rizzoli,,ARTIST - H,New York,"Biography; United States; Artists; Homer, Winslow; Juvenile literature",,,1993,,,64,
238TPY4S,"Hand-painted pop: American art in transition, 1955-62",Books,0,0-8478-1631-1,,1992,Museum of Contemporary Art ; Rizzoli International Publications,,MODERN,Los Angeles : New York,"Exhibitions; 20th century; United States; Pop art; Art, American",,,1992,,,256,
BKSKUJZK,Monet and the Mediterranean,Books,"Pissarro, Joachim; Brooklyn Museum of Art; Kimbell Art Museum",0-8478-1783-0,,1997,"Rizzoli in association with the Kimbell Art Museum, Fort Worth, Texas",,ARTIST - M,New York,"Exhibitions; Monet, Claude; Western Mediterranean in art",,,1997,,,191,
43K5LAH2,The PaineWebber art collection,Books,0,0-8478-1791-1,,1995,Rizzoli,,MODERN,New York,"20th century; Art, Modern; Art; Catalogs; New York (State) New York; Art collections Catalogs; Private collections Catalogs; Paine Webber Inc",,,1995,,,303,
DQMFRVZ5,"Margaret Bourke-White: the photography of design, 1927-1936",Books,"Phillips, Stephen Bennett; Bourke-White, Margaret; Phillips Collection",0-8478-2505-1,,2003,Phillips Collection in association with Rizzoli,,ARTIST-B,New York,"Bourke-White, Margaret; Commercial photography; Exhibitions; Photography, Artistic; Photography, Industrial",,,2003,,,207,
UJNL5Z48,Islamic painting: a survey,Books,"Rice, David Talbot",0-85224-112-7,,1971,Edinburgh University Press,,ISLAMIC,Edinburgh,Islamic painting,,,1971,,,185,
I6CPFCS8,"The Dutch Italianates: 17th-century masterpieces from Dulwich Picture Gallery, London",Books,"Dejardin, Ian; Dulwich Picture Gallery; International Arts & Artists",0-85667-657-8,,2008,Dulwich Picture Gallery in association with Philip Wilson Publishers ; Distributed in North America by Palgrave Macmillan,,EUROPEAN - NORTHERN,"London : New York, NY","History; Exhibitions; Italy; In art Exhibitions; 17th century; Dulwich Picture Gallery; Dutch Italianates (Group of artists); Landscape painting, Dutch",,,2008,,,112,
CGQUXVWM,Fox Talbot and the Invention of Photography,Books,Gail Bickland,0-85967-599-8,,1980,Godine,,NONFICT,London,0,,,1980,,,,
BCZ83PZG,Mary Cassatt: graphic art,Books,"Breeskin, Adelyn Dohme; Smithsonian Institution",0-86528-006-1,,1981,Published for Smithsonian Institution Traveling Exhibition Service by Smithsonian Institution Press,,ARTIST-C,"Washington, D.C","Cassatt, Mary; Exhibitions",,,1981,,,27,
DBB8UTI2,From Poussin to Matisse: the Russian taste for French painting: a loan exhibition from the U.S.S.R,Books,0,0-86559-086-9,,1990,Art Institute of Chicago ; Metropolitan Museum of Art : Distributed by H.N. Abrams,,EUROPEAN,Chicago : New York,"Painting, French; Exhibitions; Gosudarstvennyĭ Ėrmitazh (Russia); Gosudarstvennyĭ muzeĭ izobrazitelʹnykh iskusstv imeni A.S. Pushkina",,,1990,,,168,
LPTK5KIA,Ivan Albright,Books,"Donnell, Courtney Graham; Cozzolino, Robert; Rossen, Susan F.; Weininger, Susan; Art Institute of Ch",0-86559-142-3,,1997,Art Institute of Chicago ; Distributed by Hudson Hills Press,,ARTIST-A,[Chicago] : New York,"Albright, Ivan; Exhibitions",,1st ed,1997,,,208,
FJH3E8GV,African art at the Art Institute of Chicago,Books,0,0-86559-149-0,,1997,Art Institute of Chicago,,AFRICAN,"Chicago, Ill","Art; Catalogs; Art Institute of Chicago; Illinois Chicago; Africa, Sub-Saharan; Art, African; Art, Black",Art Institute of Chicago Museum Studies,,1997,,,101,
YJBFQ4QD,The lamps of Louis Comfort Tiffany,Books,"Tiffany, Louis Comfort; Cooke, Colin; Eidelberg, Martin P.",0-86565-163-9,,2005,Vendome Press,,Glass,New York,"History; 20th century; United States; Catalogs; Criticism and interpretation; Tiffany, Louis Comfort; Decoration and ornament; Art nouveau; Glass lampshades; Lamps",,1st ed,2005,,,224,
TJYBX9EA,"Russian & Greek icons: from the Charles Pankow collection of Russian & Greek icons, thirteenth through the nineteenth century",Books,0,0-86576-034-9,,1982,Van Doren Gallery ; Distributed by W. Kaufmann,,MEDIEVAL,"San Francisco : [Los Altos, CA","Catalogs; Art collections Catalogs; Icons; Icons, Greek; Icons, Russian; Pankow, Charles; Private collections Catalogs",,,1982,,,80,
MZSXP98Z,The craftsman in America,Books,0,0-87044-176-0,,1975,The Society,,DECORATIVE ARTS,Washington,United States; Artisans; Handicraft,,,1975,,,199,
AXKEWK9R,"Ambroise Vollard, éditeur: prints, books, bronzes",Books,"Johnson, Una E.; Museum of Modern Art (New York, N.Y.)",0-87070-062-6,,1977,Museum of Modern Art ; distributed by New York Graphic Society,,IMPRESSIONISM-J,New York : Boston,"19th century; 20th century; Bronzes; Exhibitions; France; Illustration of books; Prints, French; Vollard, Ambroise",,,1977,,,176,
9WYNTHRX,Art of the twenties,Books,0,0-87070-216-5,,1979,Museum of Modern Art,,MODERN,New York,Exhibitions; Modernism (Art); Avant-garde (Aesthetics),,,1979,,,142,
CG8PKQNM,African textiles and decorative arts,Books,"Sieber, Roy; Museum of Modern Art (New York, N.Y.)",0-87070-227-0,,1972,"Museum of Modern Art; distributed by New York Graphic Society, Greenwich, Conn",,AFRICAN,New York,Africa; Decoration and ornament; Textile fabrics,,,1972,,,239,
VU2MZMQJ,An invitation to see: 125 paintings from the Museum of Modern Art,Books,0,0-87070-231-9,,1973,"Museum of Modern Art; Distributed by New York Graphic Society, Greenwich, Conn",,CATALOGUE,New York,"20th century; Painting; Catalogs; New York (State) New York; Painting, Modern",,,1973,,,159,
TRUGM49P,Before photography: painting and the invention of photography,Books,"Galassi, Peter; Museum of Modern Art (New York, N.Y.)",0-87070-253-X,,1981,Museum of Modern Art ; Distributed by New York Graphic Society,,PHOTOGRAPHY,New York : Boston,"19th century; Exhibitions; Art, Modern; Photography, Artistic; Art and photography",,,1981,,,151,
FWDH79RD,"Patrick Henry Bruce, American modernist: a catalogue raisonne",Books,"Agee, William C.; Rose, Barbara; Museum of Fine Arts, Houston; Museum of Modern Art (New York, N.Y.)",0-87070-259-9,,1979,Museum of Modern Art,,ARTIST-B,New York,"Bruce, Patrick Henry; Exhibitions",,,1979,,,225,
LGMF2ZAL,Joseph Cornell,Books,0,0-87070-271-8,,1980,Museum of Modern Art,,Artist - C,New York,"Cornell, Joseph",,,1980,,,295,
BLGLFXL5,Cézanne: the late work: essays,Books,0,0-87070-278-5,,1977,Museum of Modern Art ; distributed by New York Graphic Society,,Artist-C,New York : Boston,"Cézanne, Paul",,,1977,,,416,
HY7SFCU2,The History of Photography: From 1839 to the Present Day,Books,"Newhall, Beaumont",0-87070-375-7,,1964,Museum of Modern Art,,PHOTOGRAPHY,,0,,,1964,,,,
FDGIKJLQ,Paul Klee,Books,"Klee, Paul; Lanchner, Carolyn; Museum of Modern Art (New York, N.Y.)",0-87070-403-6,,1987,"Distributed by New York Graphic Society Books/Little, Brown",,Artist K,Boston,"Exhibitions; Criticism and interpretation; Klee, Paul",,,1987,,,344,
Q5T8YRCX,Ellsworth Kelly,Books,"Goossen, E. C.; Kelly, Ellsworth",0-87070-413-3,,1973,"Museum of Modern Art; distributed by New York Graphic Society, Greenwich, Conn",,Artist K,New York,"Kelly, Ellsworth",,,1973,,,127,
GPZ6ANMJ,"Sol Lewitt: the Museum of Modern Art, New York: [exhibition]",Books,"LeWitt, Sol; Legg, Alicia; Lippard, Lucy R.; Rose, Bernice; Rosenblum, Robert; Museum of Modern Art ",0-87070-427-3,,1978,The Museum,,Artist L,New York,"Exhibitions; LeWitt, Sol",,,1978,,,181,
EFPW6HVN,Andre Masson,Books,"Rubin, William; Lanchner, Carolyn",0-87070-464-8,,1976,Museum of Modern Art,,ARTIST - M,New York,"France; Biography; Painters; Masson, André",,,1976,,,232,
6E93M6NB,Mirrors and windows: American photography since 1960,Books,0,0-87070-475-3,,1978,Museum of Modern Art ; distributed by New York Graphic Society,,PHOTOGRAPHY,New York : Boston,"Exhibitions; Photography, Artistic",,,1978,,,152,
K2UYBV2U,The meanings of modern art,Books,"Russell, John",0-87070-477-X,,1974,Museum of Modern Art,,MODERN,New York,"19th century; 20th century; Art, Modern; Color in art; Emotions in art",,,1974,,,12,
IPTA9HPT,"The natural paradise: painting in America, 1800-1950: [exhibition], the Museum of Modern Art, New York",Books,0,0-87070-504-0,,1976,The Museum ; distributed by New York Graphic Society,,AMERICAN,New York : Boston,"In art; Exhibitions; 20th century; United States; Romanticism in art; Landscape painting, American",,,1976,,,178,
NDTA3GXD,Prints of the twentieth century: a history: with ill. from the collection of The Museum of Modern Art,Books,"Castleman, Riva; Museum of Modern Art (New York, N.Y.)",0-87070-520-2,,1976,The Museum : distributed by Oxford University Press,,MODERN,New York,20th century; Prints,,,1976,,,216,
WCD8AMSM,Henri Rousseau: essays,Books,0,0-87070-564-4,,1985,Museum of Modern Art ; Distributed by New York Graphic Society Books,,ARTIST - R,New York : Boston,"France; Exhibitions; Primitivism in art; Rousseau, Henri",,,1985,,,269,
R2JCP489,"The ""wild beasts"": Fauvism and its affinities",Books,"Elderfield, John; Kimbell Art Museum; Museum of Modern Art (New York, N.Y.); San Francisco Museum of",0-87070-639-X,,1976,Museum of Modern Art : distributed by Oxford University Press,,MODERN,New York,"Exhibitions; 20th century; Art, Modern; Fauvism",,,1976,,,167,
GPLNI97N,Ansel Adams: Yosemite and the Range of Light,Books,"Adams, Ansel",0-87070-649-7,,,,,ARTIST-A,,0,,,,,,,
5M2PK3YG,De Kooning: a retrospective,Books,"Elderfield, John; Coddington, James; De Kooning, Willem; Field, Jennifer; Frankel, David; Huisinga, ",0-87070-797-3,,2011,"The Museum of Modern Art : Distributed in the U.S. by D.A.P./Distributed Art Publishers, Inc",,ARTIST - D OVERSIZE,New York,"2011; Abstract expressionism; Ausstellung; De Kooning, Willem; Exhibitions; New York, NY",,,2011,,,504,
2IV7DXT4,Masterpieces of painting in the Metropolitan Museum of Art,Books,0,0-87099-015-2,,1970,Distributed by New York Graphic Society,,CATALOGUE,"Greenwich, Conn.",Exhibitions; Painting,,,1970,,,118,
