SI,Title,Type,Authors,ISBN,ISBN13,Publication Year,Publisher,Category,Call No,Location,Subject,Series,Edition,Year,Description,Tags,Num Pages,Place
SQSR7IY3,Bonnard: the late paintings,Books,"Bonnard, Pierre; Newman, Sasha M.; Dallas Museum of Art; Musée national d'art moderne (France); Phil",0-500-09165-X,,1984,Phillips Collection : Dallas Museum of Art,,ARTIST-B,"Washington, D.C. : [Dallas, Tex.]","Bonnard, Pierre; Exhibitions",,,1984,,,288,
T9HZLXFV,Agnes Martin: her life and art,Books,"Princenthal, Nancy",0-500-09390-3,,2015,Thames & Hudson,,Artist M,"New York, NY","20th century; Biography; Painters; United States; Artists; Painting, Abstract; Biographies; 1900-talet; Abstrakt konst; biografi; biography; Förenta staterna; Konstnärer; Målare (bildkonstnärer); Martin, Agnes",,,2015,,,288,
U9H4VMCJ,Pop art redefined,Books,"Russell, John; Gablik, Suzi; Hayward Gallery",0-500-18094-6,,1969,Thames & Hudson,,MODERN,London,Exhibitions; Pop art,,,1969,,,240,
9F4TP2FJ,A concise history of modern sculpture,Books,"Read, Herbert",0-500-20014-9,,1983,Thames and Hudson : Distributed by W.W. Norton,,Sculpture,"New York, N.Y","History; 20th century; Sculpture, Modern",World of art,,1983,,,310,
6E987SLL,English painting: a concise history,Books,"Gaunt, William",0-500-20016-5,,1985,Thames and Hudson,,EUROPEAN - BRITISH ISLES,"New York, N.Y","Painting, English",World of art,,1985,,,288,
274VZNBI,A Concise History of Venetian Painting,Books,"Steer, John",0-500-20101-3,,1979,Thames and Hudson,,RENAISSANCE,,0,,,1979,,,,
IUK56HLB,"The high Renaissance and Mannerism: Italy, the North and Spain, 1500-1600",Books,"Murray, Linda; Murray, Linda",0-500-20162-5,,1977,Thames and Hudson,,RENAISSANCE,London,"Mannerism (Art); Art, High Renaissance; Art, Late Renaissance",The World of art library,New ed.,1977,,,287,
H2RCJFE9,The classical language of architecture,Books,"Summerson, John",0-500-20177-3,,1980,Thames and Hudson,,ARCHITECTURE,London,Architecture; Terminology; Details,World of art library,Rev. and enl. ed,1980,,,144,
JQMUMFKF,The architecture of the eighteenth century,Books,"Summerson, John",0-500-20202-8,,1986,Thames and Hudson,,ARCHITECTURE,"New York, N.Y","History; Europe; 18th century; Architecture; Architecture, Baroque; Neoclassicism (Architecture)",World of art,,1986,,,176,
BNJ2VTQ9,"Women, art, and society",Books,"Chadwick, Whitney",0-500-20241-9,,1990,Thames and Hudson,,GENERAL HISTORY,"New York, N.Y",Women in art; Art and society; Feminism and art; Women artists; Biography History and criticism,World of art,,1990,,,383,
BUBYWKGW,Klimt,Books,"Whitford, Frank",0-500-20246-X,,1990,Thames and Hudson,,Artist - K,"New York, N.Y","Biography; Artists; Klimt, Gustav; Austria",World of art,,1990,,,216,
B7SZYLHE,The arts and crafts movement,Books,"Cumming, Elizabeth; Kaplan, Wendy",0-500-20248-6,,1991,Thames and Hudson,,DECORATIVE ARTS,"New York, N.Y",History; Arts and crafts movement,World of art,,1991,,,216,
5BGXWQVE,The Thames & Hudson dictionary of art terms,Books,"Lucie-Smith, Edward",0-500-20365-2,,2004,Thames & Hudson,,General Reference,"New York, N.Y",Art; Dictionaries,Thames & Hudson world of art,2nd ed,2004,,,240,
MSLK3F3J,Africa: tribal art of forest and savanna,Books,"Bamert, Arnold",0-500-23318-7,,1980,Thames and Hudson,,AFRICAN,"New York, N.Y","Art, West African",,,1980,,,332,
VZF7E5JJ,Catholica: the visual culture of Catholicism,Books,"Ivanič, Suzanna",0-500-25254-8,,2022,Thames & Hudson Ltd,,Religion/Myth,London ; New York,In art; Art; Christian art and symbolism; Church architecture; Architecture chrétienne; Catholic Church; Christian saints in art; Christianisme et art; Christianity and art; Church decoration and ornament; churches (buildings); Église catholique; Ill,,,2022,,,255,
P9UI598I,The body in pieces: the fragment as a metaphor of modernity,Books,"Nochlin, Linda",0-500-55027-1,,1995,Thames and Hudson,,MODERN,"New York, N.Y",Art; Philosophy; Human beings in art; Visual arts Special subjects Human figures,Walter Neurath memorial lectures,,1995,,,64,
MLAVQZ9K,Rodin,Books,"Taillandier, Yvon",0-517-08266-7,,1988,Crown Publishers,,ARTIST - R,New York,"Criticism and interpretation; Rodin, Auguste",Crown art library,,1988,,,96,
PWPEWDL6,Bonnard,Books,"Cogniat, Raymond",0-517-09889-X,,1988,Crown Publishers,,ARTIST-B,New York,"Biography; Bonnard, Pierre; France; Painters",Crown art library,,1988,,,94,
K9XDU2HH,Rembrandt paintings,Books,"Gerson, H.; Rembrandt Harmenszoon van Rijn; Schwartz, Gary",0-517-25420-4,,1978,Harrison House,,ARTIST - R OVERSIZE,New York,Rembrandt Harmenszoon van Rijn,,,1978,,,527,
494GTL3Q,"History's timeline: a 40,000-year chronology of world civilization",Books,0,0-517-34000-3,,1981,Crescent Books : Distributed by Crown Publishers,,General Reference,New York,Civilization; Chronology,,,1981,,,240,
ZPKVGC4T,The Complete Etchings of Rembrandt,Books,"Harris, Bruce & Seena",0-517-51388-9,,1970,Bounty Books,,ARTIST - R,,0,,,1970,,,,
6D8CIYI7,James Ensor,Books,"Janssens, Jacques",0-517-53284-0,,1978,Crown Publishers,,ARTIST - E,New York,"Belgium; Biography; Ensor, James; Painters",,,1978,,,96,
TVE2PDAS,"The Art Institute of Chicago, favorite impressionist paintings",Books,0,0-517-53550-5,,1979,Crown Publishers,,IMPRESSIONISM-M,"New York, N.Y",Art Institute of Chicago; Catalogs; Illinois Chicago; Painting,,,1979,,,106,
F5RC2SP5,Louise Nevelson: atmospheres and environments,Books,"Nevelson, Louise; Albee, Edward; Whitney Museum of American Art",0-517-54051-7,,1980,C.N. Potter : distributed by Crown,,ARTIST - N,New York,"Catalogs; Nevelson, Louise",,,1980,,,191,
FQ2B8C5H,Japonisme: the Japanese influence on western art in the 19th and 20th centuries,Books,"Wichmann, Siegfried",0-517-54507-1,,1981,Harmony Books,,JAPANESE,New York,"19th century; 20th century; Art, Modern; Japanese influences; Japonism",,1st ed,1981,,,432,
TZDK5F7P,Places of delight: the pastoral landscape,Books,"Cafritz, Robert; Gowing, Lawrence; Rosand, David; National Gallery of Art (U.S.); Phillips Collectio",0-517-56979-5,,1988,Phillips Collection in association with the National Gallery of Art ; C.N. Potter : Distributed by Crown,,GENERAL HISTORY,"Washington, D.C. : New York","Exhibitions; Influence Exhibitions; Painting, Italian; Painting, Renaissance; Italy Venice; Landscape painting",,,1988,,,270,
V37Z32Y8,Monet: a retrospective,Books,"Monet, Claude; Stuckey, Charles F.",0-517-61824-9,,1986,Park Lane : Distributed by Crown Publishers,,Artist Oversize,New York,"France; Impressionism (Art); Criticism and interpretation; Monet, Claude",,,1986,,,387,
NCZGWDLW,Renoir A Retrospective,Books,Nicholas Wadley,0-517-68613-9,,1987,Park Lane,,Artist Oversize,New York,0,,,1987,,,,
7TTSTJTK,Art and visual perception: a psychology of the creative eye,Books,"Arnheim, Rudolf",0-520-02327-7,,1974,University of California Press,,GENERAL APPRECIATION/CRITICISM,Berkeley,Visual perception; Art; Psychology,,"New version, expanded and rev. ed",1974,,,508,
RKVDWGJ2,German Expressionist Painting,Books,"Selt, Peter",0-520-02515-6,,1957,University of California Press,,MODERN,,0,,,1957,,,,
8E3ATHYK,The arts of China,Books,"Sullivan, Michael",0-520-04917-9,,1984,University of California Press,,CHINESE,Berkeley,"Art, Chinese",,3rd ed,1984,,,278,
S33Q9Z9G,Theories and documents of contemporary art: a sourcebook of artists' writings,Books,0,0-520-20251-1,,1996,University of California Press,,MODERN,Berkeley,"20th century; Art, Modern; Sources",California studies in the history of art,,1996,,,1003,
I3JHCM8L,Looking at pictures,Books,"Woodford, Susan",0-521-24371-8,,1983,Cambridge University Press,,GENERAL APPRECIATION/CRITICISM,Cambridge [Cambridgeshire] ; New York,"Visual perception; Themes, motives; Art appreciation; Picture interpretation; Pictures",Cambridge introduction to the history of art,,1983,,,112,
9M23YKAY,Nineteenth-century architecture,Books,"Reynolds, Donald M.",0-521-35596-6,,1992,Cambridge University Press,,ARCHITECTURE,Cambridge [England] ; New York,"19th century; Architecture, Modern",The Cambridge introduction to art,,1992,,,106,
7BW837EV,American art at the nineteenth-century Paris Salons,Books,"Fink, Lois Marie",0-521-38499-0,,1990,"National Museum of American Art, Smithsonian Institution ; Cambridge University Press",,AMERICAN,"Washington, D.C. : Cambridge ; New York","19th century; Exhibitions; Art, American; Salon (Exhibition : Paris, France)",,,1990,,,430,
WJCLMY5X,"American painted furniture, 1660-1880",Books,"Fales, Dean A.",0-525-05387-5,,1972,Dutton,,DECORATIVE ARTS,New York,United States; Decoration and ornament; Painted furniture,,1st ed.,1972,,,299,
K6ZFXUV5,"Hirshhorn, Medici from Brooklyn: a biography",Books,"Hyams, Barry",0-525-12520-5,,1979,Dutton,,MODERN,New York,"Biography; Art; Brooklyn (New York, N.Y.); Collectors and collecting Biography; Hirshhorn, Joseph H",,1st ed,1979,,,206,
26VSZV6Q,Monuments of medieval art,Books,"Calkins, Robert G.",0-525-15932-0,,1979,Dutton,,MEDIEVAL,New York,"Art, Medieval",,1st ed,1979,,,299,
VABXZNV2,The eccentrics and other American visionary painters,Books,"Davidson, Abraham A.",0-525-47500-1,,1978,Dutton,,AMERICAN,New York,"19th century; Painting, American; United States; Fantasy in art; Romanticism in art; Surrealism",,1st ed,1978,,,202,
D4V54VF9,Get the message? a decade of art for social change,Books,"Lippard, Lucy R.",0-525-48037-4,,1984,E.P. Dutton,,GENERAL HISTORY,New York,History; 20th century; Art; Art and society; Political aspects,,1st ed,1984,,,343,
96QNE5KK,The Art of performance: a critical anthology,Books,0,0-525-48039-0,,1984,E.P. Dutton,,MODERN,New York,"20th century; Performance art; Arts, Modern",,1st ed,1984,,,344,
EKGKS8NP,Small folk: a celebration of childhood in America,Books,"Brant, Sandra; Cullman, Elissa; Museum of American Folk Art",0-525-93131-7,,1980,E.P. Dutton : Museum of American Folk Art,,AMERICAN,New York,United States; Folk art; Children in art; Children's art; Children's paraphernalia,,1st ed,1980,,,180,
KW4FVKG2,Jackson Pollock,Books,"Oliver, Clare",0-531-12237-9,,2003,Franklin Watts,,K-12,New York,"Painters; Painting, American; United States; Artists; Biography Juvenile literature; Juvenile literature; Pollock, Jackson",Artists in their time,1st American ed,2003,,,46,
YAPFDWG7,Neolithic stone circles and contemporary art in the landscape,Books,"Jaeger, Elizabeth",0-533-05831-7,,1984,Vantage Press,,MODERN,New York,Great Britain; Antiquities; Archaeoastronomy; Environment (Art); Megalithic monuments; Neolithic period; Stone circles,,1st ed,1984,,,87,
QHRAZ8SS,Sensation and perception,Books,"Goldstein, E. Bruce",0-534-00760-0,,1980,Wadsworth Pub. Co,,QP431 .G64,"Belmont, Calif",Perception; Senses and sensation,,,1980,,,492,
8QFG3DXA,Sensation and perception,Books,"Goldstein, E. Bruce",0-534-00760-0,,1980,Wadsworth Pub. Co,,GENERAL APPRECIATION/CRITICISM,"Belmont, Calif",Perception; Senses and sensation,,,1980,,,492,
7FF88YC3,A history of Roman art,Books,"Kleiner, Fred S.",0-534-63846-5,,2007,Thomson/Wadsworth,,ANCIENT,Australia ; United States,"Art, Roman",,,2007,,,340,
T2B4VHH6,The birth and rebirth of pictorial space,Books,"White, John",0-571-09946-7,,1972,Faber,,RENAISSANCE,London,"Perspective; Italy; Painting, Italian; Painting, Renaissance",Faber paper covered editions,2nd ed,1972,,,3,
LW5BEPKS,Looking into paintings,Books,0,0-571-13669-9,,1985,Faber and Faber,,GENERAL APPRECIATION/CRITICISM,London ; Boston,Painting; Appreciation,,,1985,,,302,
Z4QH8VPI,Unquiet landscape: places and ideas in twentieth-century English painting,Books,"Neve, Christopher",0-571-15291-0,,1990,Faber and Faber,,MODERN,London ; Boston,"20th century; Themes, motives; Painting, English",,,1990,,,166,
ZCYLUZT3,African American History: Four Centuries of Black Life,Books,"Hughes, Langston; Meltzer",0-590-35452-3,,1990,Scholastic Incorporated,,GENERAL HISTORY,,0,,,1990,,,,
YYFKJ2YU,Roman mythology,Books,"Perowne, Stewart",0-600-03347-3,,1969,Hamlyn,,ANCIENT,"London, New York","Mythology, Roman",,,1969,,,141,
G7UMY8WW,Matisse,Books,"Orienti, Sandra; Matisse, Henri",0-600-35928-X,,1972,Hamlyn,,ARTIST - M,"London, New York","Matisse, Henri",Twentieth-century masters,,1972,,,96,
9C2R7ZR9,The world of William Glackens,Books,0,0-615-41981-X,,2011,Sansom Foundation ; Distributed by D.A.P./Distributed Art Publishers,,ARTIST - G,[United States?] : New York,"Criticism and interpretation; Glackens, William J; Ashcan school of art; Figurative art, American",The C. Richard Hilker art lectures,,2011,,,212,
BZHHMYNL,Let Us Now Praise Famous Men,Books,"Agee, James and Evans",0-618-12749-6,,1988,Houghton Mifflin Company,,ARTIST - E,,0,,,1988,,,,
4MJ5NZKQ,"Matisse, Picasso",Books,0,0-642-33485-4,,2019,National Gallery of Australia,,ARTIST - M,"Canberra, Australian Capital Territory","Exhibitions; 20th century; Art, Modern; Artists; Exhibition catalogs; Matisse, Henri; 1900-1999; Picasso, Pablo",,,2019,,,196,
X9ZLMEIY,Treasures of Islam,Books,"Bamborough, Philip",0-668-04178-1,,1977,Arco Pub. Co,,ISLAMIC,New York,Islamic art,,,1977,,,160,
UUICAC57,"Roman society: a social, economic, and cultural history",Books,"Boren, Henry Charles",0-669-84681-3,,1977,D.C. Heath,,ANCIENT,"Lexington, Mass",History; Rome,Civilization and society,,1977,,,320,
VWGZFFLG,The artist's handbook of materials and techniques,Books,"Mayer, Ralph",0-670-13665-4,,1970,Viking Press,,GENERAL METHODS/TECHNIQUES,New York,Technique; Painting; Artists' materials,,"3d ed., rev. and expanded",1970,,,750,
UPQI4B6E,The Autobiography of surrealism,Books,0,0-670-14235-2,,1980,Viking Press,,MODERN,New York,"20th century; Surrealism; Arts, Modern",The Documents of 20th century art,,1980,,,472,
9NFRHRC8,"The flowering of American folk art, 1776-1876",Books,"Lipman, Jean; Winchester, Alice; Whitney Museum of American Art",0-670-32120-6,,1974,"Viking Press, in cooperation with the Whitney Museum of American Art",,AMERICAN,New York,United States; Primitivism in art; Folk art,A Studio book,,1974,,,288,
TUV8XBHC,The Hudson River and its painters,Books,"Howat, John K.",0-670-38558-1,,1972,Viking Press,,AMERICAN,New York,"19th century; Landscape painting, American; Hudson River school of landscape painting",A Studio book,,1972,,,207,
HPRXVUJS,Men of Athens: the story of fifth century Athens,Books,"Warner, Rex",0-670-46884-3,,1972,Viking Press,,ANCIENT,New York,Athens (Greece); Intellectual life,A Studio book,,1972,,,264,
9ZI6AZPH,The Penguin companion to the arts in the twentieth century,Books,"McLeish, Kenneth",0-670-80127-5,,1985,Viking,,MODERN,"Middlesex, England ; New York, N.Y., U.S.A","20th century; Artists; Dictionaries; Arts, Modern; Biography Dictionaries",,,1985,,,604,
4VUPZXHV,A painter of darkness: Leon Golub and our times,Books,"Marzorati, Gerald",0-670-81979-4,,1990,Viking,,ARTIST - G,"New York, N.Y., U.S.A","Criticism and interpretation; Golub, Leon",,,1990,,,271,
BKTFTYDX,The Britannica encyclopedia of American art,Books,0,0-671-21616-3,,1973,"Encyclopaedia Britannica Educational Corp.; distribution by Simon and Schuster, New York",,GENERAL REFERENCE,Chicago,"United States; Artists; Art, American; Dictionaries; Biography Dictionaries",,,1973,,,669,
TUADUKEH,Tiffany windows,Books,"Duncan, Alastair",0-671-24951-7,,1980,Simon and Schuster,,Glass,New York,"United States; Tiffany, Louis Comfort; Stained glass windows",,,1980,,,224,
ZB3V7TK7,The Timetables of History: A Horizontal Linkage of People and Events,Books,"Grun, Bernard",0-671-24988-6,,1979,Simon and Schuster,,GENERAL HISTORY,,0,,,1979,,,,
HVHF6467,A woman on paper: Georgia O'Keeffe,Books,"Pollitzer, Anita",0-671-66242-2,,1988,Simon & Schuster,,ARTIST - O,New York,"Biography; United States; Artists; O'Keeffe, Georgia",A Touchstone book,,1988,,,290,
ZDIJ78HB,The glorious impossible,Books,"L'Engle, Madeleine; Giotto",0-671-68690-9,,1990,Simon and Schuster Books for Young Readers,,ARTIST - G,New York,Art; Biography Juvenile literature; Giotto; Jesus Christ,,,1990,,,64,
GHYPRUEG,The Wright style,Books,"Lind, Carla",0-671-74959-5,,1992,Simon & Schuster,,Artist,New York,"United States; Criticism and interpretation; Themes, motives; Wright, Frank Lloyd; Dwellings",,,1992,,,224,
JHZU6754,Picasso: Fifty Years of his Art,Books,"Barr, Jr",0-672-52649-2,,1974,Arno Press,,ARTIST - P,,0,,,1974,,,,
44Y6EMPE,The Parthenon sculptures,Books,"Jenkins, Ian",0-674-02692-6,,2007,Harvard University Press,,NON-CIRCULATING REFERENCE,"Cambridge, Mass","Elgin marbles; Parthenon (Athens, Greece)",,,2007,,,144,
GBCGQ542,"Great French paintings from the Barnes Foundation: Impressionist, Post-impressionist, and Early Modern",Books,0,0-679-40963-7,,1993,Knopf ; in association with Lincoln University Press,,MODERN,New York,"19th century; France; Impressionism (Art); Painting, French; Post-impressionism (Art); 20th century; Painting; Modernism (Art); Private collections; Catalogs; Barnes Foundation; Pennsylvania Merion",,1st ed,1993,,,318,
AEVTEA64,Mixed Blessings: New Art in a Multicultural America,Books,"Lippard, Lucy R.",0-679-72966-6,,1990,Pantheon Books,,MODERN,,0,,,1990,,,,
KLBE59GY,Symbols and legends in Western art: a museum guide,Books,"Whittlesey, Eunice S.",0-684-12583-8,,1972,Scribner,,General Reference,New York,Symbolism in art; Dictionaries; Mythology; Art and mythology; Symbolism,,,1972,,,367,
H89CT7XF,Readings in art history,Books,0,0-684-17619-X,,1982,Scribner,,Art History,New York,History; Art,,3rd ed,1982,,,2,
MINPAFQP,Boundaries,Books,"Lin, Maya Ying",0-684-83417-0,,2000,Simon & Schuster,,Artist M,New York,"Lin, Maya Ying; Notebooks, sketchbooks, etc; Sources",,,2000,,,1,
JXV7RXEZ,Superrealist painting & sculpture,Books,"Lindey, Christine",0-688-03686-4,,1980,Morrow,,MODERN,New York,"20th century; United States; Art, American; Photo-realism",,,1980,,,160,
DEVLFMPB,An enduring image: American painting from 1665,Books,"Freedgood, Lillian",0-690-26619-7,,1970,Crowell,,AMERICAN,New York,"Painting, American",,,1970,,,387,
FCNYLNLN,Rubens: The Artist as Collector,Books,"Muller, Jeffrey M.",0-691-00298-3,,1989,Princeton University Press,,ARTIST - R,,0,,,1989,,,,
QE9BW3E8,"French painting between the past and the present: artists, critics, and traditions, from 1848 to 1870",Books,"Sloane, Joseph C.",0-691-00306-8,,1951,Princeton University Press,,EUROPEAN - FRANCE,"Princeton, N.J","19th century; Painting, French",Princeton monographs in art and archaeology,,1951,,,241,
9P6V9DIZ,Art and Illusion: A Study in the Psychology of Pictorial Representation,Books,"Gombrich, E. H.",0-691-01750-6,,1972,Princeton University Press,,GENERAL APPRECIATION/CRITICISM,,0,,,1972,,,,
9C9TD7UY,The stones of Athens,Books,"Wycherley, R. E.",0-691-03553-9,,1978,Princeton University Press,,ANCIENT,"Princeton, N.J",Antiquities; Excavations (Archaeology); Athens (Greece); Greece; Greece Athens,,,1978,,,293,
LGVEEPT2,"Noble dreams, wicked pleasures: orientalism in America, 1870-1930",Books,0,0-691-05003-1,,2000,Princeton University Press,,AMERICAN,"Princeton, New Jersey","19th century; Exhibitions; 20th century; Arts, American; Orientalism in art",,,2000,,,242,
BW88V8HW,Walker Evans,Books,"Evans, Walker; Hambourg, Maria Morris; Metropolitan Museum of Art (New York, N.Y.); Museum of Fine A",0-691-05078-3,,2000,"Metropolitan Museum of Art in association with Princeton University Press, Princeton",,ARTIST - E OVERSIZE,New York,"Evans, Walker; Exhibitions; Photography, Artistic",,,2000,,,318,
ZBJ3RHL5,Masterpieces of Wedgwood,Books,"Dawson, Aileen",0-7141-0531-7,,1984,British Museum Press,,DECORATIVE ARTS,,0,,,1984,,,,
UG65DMFH,The Elgin marbles,Books,"Cook, B. F.",0-7141-2134-7,,1997,published for the Trustees of the British Museum by British Museum Press,,ANCIENT,London,"Themes, motives; Greece Athens; Marble sculpture, Greek; Elgin marbles; Parthenon (Athens, Greece); Marble sculpture, Ancient",,,1997,,,96,
V3HUIRSA,The great century of British painting: Hogarth to Turner,Books,"Gaunt, William",0-7148-1452-0,,1971,Phaidon,,EUROPEAN - BRITISH ISLES,London,"19th century; 18th century; Painting, English",,,1971,,,240,
2QAH9C9A,Italian Renaissance and Baroque Sculpture,Books,"Pope-Hennessy, John",0-7148-1460-1,,1970,Phaidon Press,,RENAISSANCE - BAROQUE,,0,,,1970,,,,
GVTBJWW4,British portrait painters,Books,"Gibson, Robin; Roberts, Keith",0-7148-1479-2,,1971,Phaidon,,EUROPEAN - BRITISH ISLES,London,"Catalogs; Portrait painting, British; Portraits, British",,,1971,,,16,
2DMZAJAQ,The Pre-Raphaelites,Books,"Rose, Andrea",0-7148-2907-2,,1996,Phaidon Press,,EUROPEAN - BRITISH ISLES,,0,,,1996,,,,
WM7ZV7IX,The Story of Art,Books,"Gombrich, E. H.",0-7148-3247-2,,1995,Phaidon Press,,GENERAL HISTORY,,0,,,1995,,,,
UV3YFI6Q,Jeff Wall,Books,0,0-7148-3349-5,,1996,Phaidon Press Ltd,,ARTIST - W,London,"Photography, Artistic; Wall, Jeff",,,1996,,,160,
3W2NJ8M9,Modern architecture since 1900,Books,"Curtis, William J. R.",0-7148-3356-8,,1996,Phaidon,,ARCHITECTURE,London,"20th century; Architecture, Modern",,"3rd ed., [Rev., expanded, and redesigned]",1996,,,736,
PKSKF76N,Luc Tuymans,Books,"Loock, Ulrich",0-7148-3551-X,,1996,Phaidon Press,,ARTIST - T,London,0,Contemporary art monographs,,1996,,,160,
TJ7IDPTS,William Kentridge,Books,"Cameron, Dan; Coetzee, J. M.; Kentridge, William; Christov-Bakargiev, Carolyn",0-7148-3829-2,,1999,Phaidon,,Artist K,London,"Criticism and interpretation; Interviews; Kentridge, William",Contemporary artists,,1999,,,160,
SKU2L3W4,Mike Kelley,Books,"Welchman, John C.; Graw, Isabelle; Kelley, Mike; Vidler, Anthony",0-7148-3834-9,,1999,Phaidon,,Artist K,London,"Criticism and interpretation; Kelley, Mike",Contemporary artists,,1999,,,160,
ZKKJYLI4,Yayoi Kusama,Books,"Hoptman, Laura J.; Kultermann, Udo; Kusama, Yayoi; Tatehata, Akira",0-7148-3920-5,,2000,Phaidon,,NONFICT,London,"Criticism and interpretation; Interviews; Kusama, Yayoi",Contemporary artists,,2000,,,160,
747LYV2Z,Wolfgang Tillmans,Books,"Verwoert, Jan; Halley, Peter; Matsui, Midori; Tillmans, Wolfgang",0-7148-4192-7,,2002,Phaidon Press,,ARTIST - T,"London ; New York, NY","Criticism and interpretation; Photography, Artistic; Tillmans, Wolfgang",Contemporary artists,,2002,,,160,
QJZ588G8,"Peter Fischli, David Weiss",Books,"Fleck, Robert; Danto, Arthur C.; Fischli, Peter; Söntgen, Beate; Weiss, David",0-7148-4323-7,,2005,Phaidon,,ARTIST - F,London ; New York,"Exhibitions; Fischli, Peter; Interviews; Söentgen, Beate; Weiss, David",Contemporary artists,,2005,,,160,
AE6MFCS4,"Pissarro: Camille Pissarro, 1830-1903: [exposition] Hayward Gallery, Londres, 30 octobre 1980-11 janvier 1981: Galeries nationales du Grand Palais, Paris, 30 janvier-27 avril 1981: Museum of Fine Arts, Boston, 19 mai-9 août 1981",Books,"Pissarro, Camille; Arts Council of Great Britain; Galeries nationales du Grand Palais (France); Hayw",0-7287-0253-3,,1981,"Éditions de la Réunion des musées nationaux, Ministère de la culture et de la communication",,ARTIST - P,Paris,"Exhibitions; Pissarro, Camille",,,1981,,,264,
7NJMB4WP,"Renoir: Hayward Gallery, London, 30 January-21 April 1985, Galeries nationales du Grand palais, Paris, 14 May-2 September 1985, Museum of Fine Arts, Boston, 9 October 1985-5 January 1986",Books,"Renoir, Auguste; Arts Council of Great Britain; Galeries nationales du Grand Palais (France); Haywar",0-7287-0419-6,,1985,Arts Council of Great Britain,,ARTIST - R,London,"Exhibitions; Renoir, Auguste",,,1985,,,324,
SDJF7AIB,Frink: a portrait,Books,"Frink, Elisabeth; Lucie-Smith, Edward",0-7475-1572-7,,1994,Bloomsbury,,ARTIST - F,London,"Biography; England; Frink, Elisabeth; Sculptors",,,1994,,,138,
VDF2DEJ2,Decorative arts,Books,"Miller, Judith",0-7566-2349-9,,2006,Dorling Kindersley,,DECORATIVE ARTS,New York,History; Decoration and ornament; Antiques,,1st American ed,2006,,,440,
EQU6U9WB,Encyclopedia of World Mythology,Books,Arthur Cotterell,0-7607-2855-0,,,Barnes and Noble,,Religion/Myth,New York,0,,,,,,,
3HKDQIFX,In the time of Picasso,Books,"Mason, Antony",0-7613-1628-0,,2002,Copper Beech Books,,K-12,"Brookfield, Conn","20th century; Art, Modern; Juvenile literature; Picasso, Pablo; Art appreciation; Influence",Art around the world,,2002,,,48,
7ZSG25IU,In the time of Warhol,Books,"Mason, Antony",0-7613-1629-9,,2002,Copper Beech Books,,ARTIST - W,"Brookfield, Conn","History; 20th century; Art, Modern; Artists; Juvenile literature; Art appreciation; Art movements",Art around the world,,2002,,,48,
QH8WL86C,In the time of Renoir,Books,"Mason, Antony",0-7613-2285-X,,2001,Copper Beech Books,,K-12,"Brookfield, Conn","19th century; France; Impressionism (Art); Artists; Biography Juvenile literature; Juvenile literature; Art, French; Art, Comparative",Art around the world,,2001,,,48,
494MSN54,Clearly inspired: contemporary glass and its origins,Books,"Chambers, Karen S.; Oldknow, Tina; Fort Wayne Museum of Art; Tampa Museum of Art",0-7649-0932-0,,1999,Pomegrante Communications,,Glass,"San Francisco, Calif",20th century; United States; Glass art; History Exhibitions; Foreign influences Exhibitions,,,1999,,,134,
Q5GDA4TC,Buildings across time: an introduction to world architecture,Books,"Moffett, Marian; Fazio, Michael W.; Wodehouse, Lawrence",0-7674-0511-0,,2004,McGraw-Hill,,Architecture,Boston,History; Architecture,,,2004,,,592,
ENXFSK2E,The lightning thief,Books,"Riordan, Rick; Riordan, Rick",0-7868-5629-7,,2005,Miramax Books/Hyperion Books for Children,,Religion/Myth,New York,"Fiction; Camps; Fantasy fiction; Fathers and sons; Friendship; Hades; Juvenile fiction; Mythology, Greek; Poseidon; Zeus",Percy Jackson & the Olympians,1st ed,2005,,,377,
KSMMVBRZ,Through ebony eyes: what teachers need to know but are afraid to ask about African-American students,Books,"Thompson, Gail L.",0-7879-7061-1,,2004,Jossey-Bass,,Docent/Museum Education,"San Francisco, CA",United States; African American students; Teaching,The Jossey-Bass education series,1st ed,2004,,,328,
