SI,Title,Type,Authors,ISBN,ISBN13,Publication Year,Publisher,Category,Call No,Location,Subject,Series,Edition,Year,Description,Tags,Num Pages,Place
ZKX8GZCT,Winslow Homer watercolors,Books,"Cooper, Helen A.; Amon Carter Museum of Western Art; National Gallery of Art (U.S.); Yale University",0-89468-087-0,,1986,National Gallery of Art ; Yale University Press,,ARTIST - H,Washington : New Haven,"Exhibitions; Homer, Winslow",,,1986,,,259,
YLZ6QQWZ,"Henri Matisse: the early years in Nice, 1916-1930",Books,"Cowart, Jack; Fourcade, Dominique; National Gallery of Art (U.S.)",0-89468-097-8,,1986,National Gallery of Art ; H.N. Abrams,,ARTIST - M,Washington : New York,"Exhibitions; Matisse, Henri",,,1986,,,367,
9BUIEHEJ,Nationalism in the visual arts,Books,0,0-89468-176-1,,1991,National Gallery of Art ; Distributed by the University Press of New England,,GENERAL HISTORY,"Washington : Hanover, N.H","United States; Europe; Art, American; Congresses; Art, European; Nationalism and art","Studies in the history of art / Center for Advanced Study in the Visual Arts, Symposium papers",,1991,,,172,
2FF3H6V3,The Greek miracle: classical sculpture from the dawn of democracy: the fifth century B.C,Books,"Buitron-Oliver, Diana; Gage, Nicholas; National Gallery of Art (U.S.)",0-89468-186-9,,1992,National Gallery of Art,,ANCIENT,Washington,"Exhibitions; Bronze sculpture, Greek; Marble sculpture, Greek",,,1992,,,164,
W7BVVT3D,Winslow Homer,Books,"Cikovsky, Nicolai; Homer, Winslow; Kelly, Franklin; Metropolitan Museum of Art (New York, N.Y.); Mus",0-89468-217-2,,1995,National Gallery of Art ; Yale University Press,,ARTIST - H,Washington : New Haven,"Exhibitions; Homer, Winslow; Nationalism in art",,,1995,,,420,
LC92YP75,"The Victorians: British painting, 1837-1901",Books,"Warner, Malcolm; Brock, Charles; Helmreich, Anne",0-89468-263-6,,1996,National Gallery of Art ; Distributed by Abrams,,EUROPEAN - BRITISH ISLES,Washington : New York,"Exhibitions; Great Britain; Painting, British; Painting, Victorian",,,1996,,,255,
IK2D4C9Y,"The Golden age of Naples: art and civilization under the Bourbons, 1734-1805",Books,0,0-89558-086-1,,1981,Detroit Institute of Arts ; Art Institute of Chicago,,BAROQUE,Detroit] : [Chicago,"History; Exhibitions; 18th century; Civilization; Collectors and collecting; Art, Italian; 1735-1816; Art presepio; Italy Naples; Naples (Kingdom)",,,1981,,,2,
ME3V59R3,"The Golden Age of Naples: Art and Civilization Under the Bourbons, 1734-1805",Books,The Detroit Institute,0-89558-087-,,1982,The Detroit Institute,,RENAISSANCE,,0,,,1982,,,,
2L3RJ54U,Currier & Ives,Books,0,0-89659-092-5,,1980,Abbeville Press,,ARTIST - C,New York,"19th century; In art; United States; Currier & Ives; Lithography, American",Abbeville library of art,,1980,,,112,
ELSP9UN8,John Singer Sargent,Books,"Ratcliff, Carter",0-89659-307-X,,1982,Abbeville Press,,ARTIST - S OVERSIZE,New York,"Sargent, John Singer",,1st ed,1982,,,256,
MPNYSVUX,Cassatt and her circle: selected letters,Books,0,0-89659-421-1,,1984,Abbeville Press,,ARTIST-C,New York,"Artists; Biography; Cassatt, Mary; Expatriate artists; France; United States",,1st ed,1984,,,360,
P637C22T,Jasper Johns,Books,"Francis, Richard; Johns, Jasper",0-89659-443-2,,1984,Abbeville Press,,ARTIST - J,New York,"Biography; United States; Artists; Johns, Jasper",Modern masters series,1st ed,1984,,,128,
LXLUKD5B,American impressionism,Books,"Gerdts, William H.",0-89659-451-3,,1984,Abbeville Press,,IMPRESSIONISM-G,New York,"19th century; Impressionism (Art); Painting, American; United States",,1st ed,1984,,,336,
FERKWDUP,Jennifer Bartlett,Books,"Goldwater, Marge; Bartlett, Jennifer; Smith, Roberta; Tomkins, Calvin; Walker Art Center",0-89659-519-6,,1985,Walker Art Center ; Abbeville Press,,ARTIST-B,Minneapolis : New York,"Bartlett, Jennifer",,,1985,,,168,
DELM8TFB,"Edward Hicks, his life and art",Books,"Ford, Alice; Hicks, Edward",0-89659-570-6,,1985,Abbeville Press,,ARTIST - H,New York,"Biography; Painters; United States; Hicks, Edward",,1st ed,1985,,,276,
4GZYVBEX,"Fallingwater, a Frank Lloyd Wright country house",Books,"Kaufmann, Edgar; Heinz, Thomas A.; Little, Christopher; L.D. Astorino & Associates",0-89659-662-1,,1986,Abbeville Press,,ARCHITECTURE,New York,"Criticism and interpretation; Homes and haunts; Wright, Frank Lloyd; Fallingwater (Pa.); Kauffman family",,,1986,,,190,
DT92DUGF,"Individuals: a selected history of contemporary art, 1945-1986",Books,0,0-89659-676-1,,1986,Museum of Contemporary Art ; Abbeville Press,,MODERN,Los Angeles : New York,"20th century; Art, Modern; Themes, motives",,1st ed,1986,,,371,
7ISWNF97,John La Farge: essays,Books,0,0-89659-678-8,,1987,Abbeville Press,,Artist L,New York,"Exhibitions; Criticism and interpretation; La Farge, John",,1st ed,1987,,,280,
T235NLA9,The mad potter of Biloxi: the art & life of George E. Ohr,Books,"Clark, Garth; Ellison, Robert A.; Hecht, Eugene; White, John",0-89659-927-2,,1989,Abbeville Press,,ARTIST - O,New York,"Criticism and interpretation; Pottery, American; Mississippi Biloxi; Ohr, George E",,,1989,,,192,
WTCRWXPM,Beyond the crisis in art,Books,"Fuller, Peter",0-906495-34-2,,1980,Writers and Readers Pub. Cooperative Society ; Distributed in the U.S.A. by W.W. Norton,,MODERN,"London : New York, N.Y","20th century; Themes, motives; Art, American; Art, British",Art series,,1980,,,267,
DAKBTHL4,Understanding watercolours,Books,"Mallalieu, Huon",0-907462-39-1,,1985,Antique Collectorsʾ Club,,GENERAL APPRECIATION/CRITICISM,"Woodbridge, Suffolk","19th century; England; 18th century; Collectors and collecting; Watercolor painting; Watercolor painting, English",,,1985,,,223,
T4KCQUPP,Nature staged: the landscape and still life paintings of Levi Wells Prentice,Books,"Jones, Barbara L.; Prentice, Levi Wells; Adirondack Museum",0-910020-44-2,,1993,Adirondack Museum,,ARTIST - P,"Blue Mountain Lake, N.Y","Exhibitions; Nature (Aesthetics); Prentice, Levi Wells",,,1993,,,95,
F7TPU9DK,"Identifying American furniture: a pictorial guide to styles and terms, colonial to contemporary",Books,"Naeve, Milo M.; American Association for State and Local History",0-910050-52-X,,1981,American Association for State and Local History,,DECORATIVE ARTS,"Nashville, Tenn",United States; Expertising; Furniture; Styles,,,1981,,,87,
UXI3T7QI,Handbook: The Cleveland Museum of Art/1969,Books,0,0-910386-08-0,,1970,Cleveland Museum of Art,,CATALOGUE,,0,,,1970,,,,
BAXJD2E6,"The European vision of America: a special exhibition to honor the Bicentennial of the United States, organized by the Cleveland Museum of Art with the collaboration of the National Gallery of Art, Washington, and the Réunion des musées nationaux, Paris",Books,"Honour, Hugh; Cleveland Museum of Art; National Gallery of Art (U.S.); Réunion des musées nationaux ",0-910386-26-9,,1975,Cleveland Museum of Art ; distributed by Kent State University Press,,EUROPEAN,"Cleveland : Kent, Ohio","In art; Exhibitions; United States; Art, European",,,1975,,,389,
Y45GDVU4,"Chardin, 1699-1779: a special exhibition organized by the Réunion des Musées Nationaux, Paris, the Cleveland Museum of Art, and Museum of Fine Arts, Boston",Books,"Rosenberg, Pierre; Chardin, Jean Baptiste Siméon; Goodfellow, Sally W.; Cleveland Museum of Art; Gal",0-910386-48-X,,1979,Cleveland Museum of Art,,Artist-C,Cleveland,"Chardin, Jean Baptiste Siméon; Exhibitions",,,1979,,,423,
VG9B98XY,"The realist tradition: French painting and drawing, 1830-1900",Books,"Weisberg, Gabriel P.; Cleveland Museum of Art",0-910386-60-9,,1980,Cleveland Museum of Art ; distributed by Indiana University Press,,EUROPEAN - FRANCE,"Cleveland : Bloomington, Ind","19th century; Exhibitions; Realism in art; Art, French",,,1980,,,346,
2472C7TT,American realism and the industrial age,Books,"Doezema, Marianne; Cleveland Museum of Art",0-910386-61-7,,1980,Cleveland Museum of Art ; Indiana University Press [distributor],,AMERICAN,"Cleveland, Ohio : Bloomington, Ind","19th century; Exhibitions; United States; Art, American; Realism in art; Art and industry",A Themes in art book,,1980,,,143,
9J8SJIKZ,Reflections of reality in Japanese art,Books,"Lee, Sherman E.; Cunningham, Michael R.; Ulak, James T.; Japan; Cleveland Museum of Art; Kokusai Kōr",0-910386-70-6,,1983,Cleveland Museum of Art ; Distributed by Indiana University Press,,JAPANESE,"Cleveland, Ohio : Bloomington, Ind","Exhibitions; Art, Japanese; Realism in art",,,1983,,,292,
P7X32SX5,Reflections of greatness: ancient Egypt at the Carnegie Museum of Natural History,Books,0,0-911239-14-6,,1990,The Museum,,ANCIENT,"Pittsburgh, Pa",Catalogs; Antiquities Catalogs; Carnegie Museum of Natural History; Egypt,,,1990,,,118,
XUZJRAV7,The Carnegie Series on Egypt,Books,"Romano, James F. et al",0-911239-33-2,,1990,Carnegie Museum of Natural History,,ANCIENT,,0,,,1990,,,,
XKBADVPM,"European painting and sculpture, ca. 1770-1937, in the Museum of Art, Rhode Island School of Design",Books,0,0-911517-55-3,,1991,The Museum,,EUROPEAN,"Providence, R.I","19th century; 20th century; Art; Catalogs; Art, European; Museum of Art; Rhode Island Providence; Rhode Island School of Design",,,1991,,,284,
GRTREYJD,Japanese mythology,Books,"Piggott, Juliet",0-911745-09-2,,1983,P. Bedrick Books : Distributed in the USA by Harper & Row,,JAPANESE,"New York, N.Y","Mythology, Japanese",Library of the world's myths and legends,New rev. ed,1983,,,144,
3M5NX3VR,Handbook of paintings,Books,0,0-912114-09-6,,1978,The Collection,,CATALOGUE,New York,Painting; Catalogs; New York (State) New York; Frick Collection,,,1978,,,174,
UZKF578V,The Frick Collection: guide to the galleries,Books,0,0-912114-10-X,,1979,The Collection,,CATALOGUE,New York,Frick Collection,,,1979,,,126,
SRGFZWDB,"American paintings, 1750-1900, from the collection of the Baltimore Museum of Art",Books,0,0-912298-53-7,,1983,The Museum,,AMERICAN,"Baltimore, Md","19th century; Painting; Painting, American; Catalogs; 18th century; Baltimore Museum of Art; Maryland Baltimore",,,1983,,,187,
5BWA8M2F,Seeing things differently,Books,0,0-912724-23-4,,1992,Fort Church Publishers,,DECORATIVE ARTS,"Little Compton, R.I","Decorative arts, Early American; Henry Francis du Pont Winterthur Museum",A Winterthur book,,1992,,,80,
TKK3NJXS,"The American craftsman and the European tradition, 1620-1820",Books,0,0-912964-37-5,,1989,Minneapolis Institute of Arts ; Distributed by the University Press of New England,,DECORATIVE ARTS,"Minneapolis, Minn. : Hanover, N.H","19th century; Exhibitions; United States; 18th century; History Exhibitions; Decorative arts; Decorative arts, Colonial; European influences Exhibitions",,,1989,,,295,
VVHTEQ3P,Jeff Wall,Books,"Brougher, Kerry; Wall, Jeff; Hirshhorn Museum and Sculpture Garden; Mito Geijutsukan; Museum of Cont",0-914357-47-6,,1997,Museum of Contemporary Art ; Scalo ; Distributed in North America by D.A.P,,ARTIST - W,Los Angeles : Zurich ; New York : New York,"Exhibitions; Photography, Artistic; Wall, Jeff",,,1997,,,162,
6WCWJ8D7,Constructivism and the geometric tradition: selections from the McCrory Corporation Collection,Books,0,0-914782-27-4,,1979,Albright-Knox Art Gallery,,MODERN,Buffalo,"Exhibitions; 20th century; United States; Art, Modern; Art; Private collections; Art collections Exhibitions; Constructivism (Art); McCrory Corporation",,,1979,,,94,
U8EBFJHU,Being & time: the emergence of video projection,Books,0,0-914782-94-0,,1996,Buffalo Fine Arts Academy,,VIDEO,"Buffalo, NY","Exhibitions; 20th century; United States; Art, American; Video art",,,1996,,,95,
BLCC62JE,"The British imagination: twentieth-century paintings, sculpture, and drawings",Books,0,0-915057-36-0,,1990,Hirschl & Adler Galleries,,MODERN,New York,"Exhibitions; 20th century; Art, British",,,1990,,,144,
2XDFLVUZ,Charles Meryon and Jean-François Millet: etchings of urban and rural 19th-century France,Books,0,0-915977-10-9,,1993,"Georgia Museum of Art, University of Georgia",,ARTIST - M,"Athens, Ga","Exhibitions; Millet, Jean-François; City and town life in art; Country life in art; Méryon, Charles",,,1993,,,142,
W3P949MY,A legacy in bricks and mortar: African-American landmarks in Allegheny County,Books,0,0-916670-17-1,,1995,Pittsburgh History & Landmarks Foundation,,ARCHITECTURE,Pittsburgh,History; African Americans; Pennsylvania Pittsburgh; Allegheny County (Pa.); Historic sites; Pennsylvania Allegheny County; Pittsburgh (Pa.),,,1995,,,78,
PBPCGENZ,Master drawings by Picasso,Books,"Tinterow, Gary; Picasso, Pablo; Art Institute of Chicago; Fogg Art Museum; Philadelphia Museum of Ar",0-916724-43-3,,1981,Fogg Art Museum,,ARTIST - P,"Cambridge, Mass","Exhibitions; Picasso, Pablo",,,1981,,,270,
DQVRWNDG,European paintings before 1900 in the Fogg Art Museum: a summary catalogue including paintings in the Busch-Reisinger Museum,Books,0,0-916724-76-X,,1990,Harvard University Art Museums,,EUROPEAN,Cambridge,"Art; Catalogs; Painting, European; Busch-Reisinger Museum; Fogg Art Museum; Massachusetts Cambridge",,,1990,,,392,
YTDQ3YPU,"Baroque portraiture in Italy: works from North American collections: the John and Mable Ringling Museum of Art, December 7, 1984-February 3, 1985, Wadsworth Atheneum, March 20-May 20, 1985",Books,"Spike, John T.; John and Mable Ringling Museum of Art; Wadsworth Atheneum",0-916758-16-8,,1984,The Museum,,BAROQUE,"Sarasota, Fla","Exhibitions; United States; Italy; Canada; Collectors and collecting Exhibitions; Portraits; Portraits, Baroque; Portraits, Italian",,,1984,,,214,
VEZBQW9D,"American Furniture: Seventeenth, Eighteenth, and Nineteenth Centuries",Books,"Comstock, Helen",0-916838-28-5,,1962,Schiffer Publishing Limited,,DECORATIVE ARTS,,0,,,1962,,,,
NFQWLD86,"American folk painting: selections from the collection of Mr. and Mrs. William E. Wiltshire III: an exhibition on display at the Virginia Museum, Richmond, November 29, 1977- January 8, 1978",Books,"Woodward, Richard B.; American Federation of Arts; Virginia Museum of Fine Arts",0-917046-02-1,,1977,The Museum,,AMERICAN,Richmond,"19th century; Exhibitions; Painting, American; United States; Art collections; 18th century; Primitivism in art; Wiltshire, William E",,,1977,,,110,
LJZUTAMQ,"Painting in the South, 1564-1980",Books,0,0-917046-14-5,,1983,Virginia Museum,,AMERICAN,Richmond,"Exhibitions; Painting, American; Southern States",,,1983,,,362,
UTK2DLQ8,African art: Virginia Museum of Fine Arts,Books,0,0-917046-37-4,,1994,The Museum,,AFRICAN,"Richmond, VA","Art; Catalogs; Africa, Sub-Saharan; Art, African; Virginia Museum of Fine Arts; Virginia Richmond",,,1994,,,94,
GEXERM3S,American art from the Currier Gallery of Art,Books,0,0-917418-99-9,,1995,American Federation of Arts,,AMERICAN,New York,"Exhibitions; Art; Art, American; Currier Gallery of Art; New Hampshire Manchester",,,1995,,,176,
N47YFXWD,"Orientalism, the Near East in French painting, 1800-1880",Books,"Rosenthal, Donald A.; Neuberger Museum; University of Rochester",0-918098-14-9,,1982,Memorial Art Gallery of the University of Rochester,,GENERAL HISTORY,"Rochester, N.Y","19th century; In art; Painting, French; Exhibitions; Middle East; Orientalism in art",,,1982,,,176,
CKJ33XJJ,Sigmar Polke,Books,"Polke, Sigmar; San Francisco Museum of Modern Art",0-918471-16-8,,1990,San Francisco Museum of Modern Art,,ARTIST - P,"San Francisco, Calif","Exhibitions; Polke, Sigmar",,,1990,,,151,
DB3J9EV4,"African majesty: from grassland and forest: the Barbara and Murray Frum Collection, May 22-July 12, 1981",Books,"Fagg, William Buller; Frum, Barbara; Frum, Murray; Art Gallery of Ontario",0-919876-73-0,,1981,Art Gallery of Ontario,,AFRICAN,Toronto,"Exhibitions; Art collections Exhibitions; Sculpture; Africa, West; Frum, Barbara; Frum, Murray",,,1981,,,152,
VR6AVK3V,Georg Baselitz: Portraits of Elke,Books,0,0-929865-16-2,,1997,Modern Art Museum of Fort Worth,,ARTIST-B,,0,,,1997,,,,
G6TWENP9,"Mermaids, mummies, and mastodons: the emergence of the American museum: [exhibition]",Books,0,0-931201-15-2,,1992,American Association of Museums,,Docent/Museum Education,"Washington, D.C","History; United States; Museums; Barnum, P. T; Peale family; Phineas Taylor",,,1992,,,104,
3WZMPHYD,Artists of the Commonwealth: realism and its response in Pennsylvania painting 1900-1950,Books,0,0-931241-30-8,,2006,Westmoreland Museum of American Art,,AMERICAN,"Greensburg, Pa","Exhibitions; Painting, American; Pennsylvania; Realism in art",,,2006,,,72,
PQHMMWWN,Painting in the United States 2008,Books,"Jones, Barbara L. and O'Toole",0-931241-36-7,,2008,Westmoreland Museum of American Art,,CATALOGUE,,0,,,2008,,,,
YYWAXJ8H,"Nigerian sculpture--bridges to power: Birmingham Museum of Art, April 15-June 3, 1984",Books,0,0-931394-12-0,,1984,Birmingham Museum of Art,,AFRICAN,"Birmingham, Ala","Exhibitions; Art and society; Nigeria; Sculpture, Nigerian",,,1984,,,64,
6WMZNCJA,Thomas Gainsborough and the modern woman,Books,0,0-931537-37-1,,2010,Giles,,ARTIST - G,London,"18th century; Art and society; Celebrities; Criticism and interpretation; Exhibitions; Gainsborough, Thomas; Great Britain; History; Portraits Exhibitions; Women; Women in art",,,2010,,,193,
XRW75NSV,Record of the Carnegie Institute's International Exhibitions 1896-1996,Books,"Falk, Peter Hastings",0-932087-55-8,,1998,Sound View Press,,CI CATALOG,,0,,,1998,,,,
JU9M63TW,Monotypes by Maurice Prendergast in the Terra Museum of American Art,Books,"Langdale, Cecily; Terra Museum of American Art",0-932171-00-1,,1984,Terra Museum of American Art,,ARTIST - P,Chicago,"Catalogs; Prendergast, Maurice; Terra Museum of American Art",,,1984,,,159,
3963QMN3,Praise poems: the Katherine White collection,Books,0,0-932216-15-3,,1984,Seattle Art Museum,,AFRICAN,"Seattle, Wash","Exhibitions; Art collections Exhibitions; Private collections Exhibitions; Sculpture; Sculpture, West African; Seattle Art Museum; Washington (State) Seattle; White, Katherine",,,1984,,,122,
X6JR6VK5,In pursuit of the dragon: traditions and transitions in Ming ceramics: an exhibition from the Idemitsu Museum of Arts,Books,0,0-932216-27-7,,1988,Seattle Art Museum,,CHINESE,"Seattle, Wash","Exhibitions; Idemitsu Bijutsukan; Ming-Qing dynasties, 1368-1912; Porcelain, Chinese; Pottery, Chinese; Song-Yuan dynasties, 960-1368",,,1988,,,160,
JBIM2G8F,"De Kooning, 1969-78",Books,"De Kooning, Willem; Cowart, Jack; Shaman, Sanford Sivitz; Contemporary Arts Center (Cincinnati, Ohio",0-932660-01-0,,1978,"Dept. of Art, University of Northern Iowa",,ARTIST - D,[Cedar Falls,"De Kooning, Willem; Exhibitions",,,1978,,,56,
3QZG8TYU,Ancient Etruscan and Greek vases in the Elvehjem Museum of Art,Books,0,0-932900-47-X,,2000,"Elvehjem Museum of Art, University of Wisconsin-Madison",,ANCIENT,"Madison, Wis","Catalogs; Vase-painting, Greek; Elvehjem Museum of Art; Vase-painting, Etruscan; Vases; Vases, Etruscan; Vases, Greek; Wisconsin Madison",,,2000,,,87,
PYTUDL4J,J.M.W. Turner,Books,"Weelen, Guy; Turner, J. M. W.",0-933516-51-7,,1982,Alpine Fine Arts Collection,,ARTIST - T OVERSIZE,New York,"Joseph Mallord William; Turner, J. M. W",,,1982,,,171,
NBLXTYKL,American masterpieces from the National Gallery of Art,Books,"Wilmerding, John",0-933920-10-5,,1980,Hudson Hills Press,,AMERICAN,New York,"Art; Washington (D.C.); Catalogs; National Gallery of Art (U.S.); Art, American",,1st ed,1980,,,180,
7G2KURAX,The great book of French impressionism,Books,"Keller, Horst",0-933920-11-3,,1980,Hudson Hills Press : trade distribution by Simon & Schuster,,IMPRESSIONISM-K,New York,"19th century; France; Impressionism (Art); Painting, French",,1st American ed,1980,,,272,
SC9U3WG9,"Mark Rothko, works on paper",Books,"Clearwater, Bonnie; Rothko, Mark; American Federation of Arts; Mark Rothko Foundation",0-933920-53-9,,1984,Published by Hudson Hills Press in association with the Mark Rothko Foundation and the American Federation of Arts : Distributed in the U.S. by Viking Penguin,,ARTIST - R,New York,"Exhibitions; Rothko, Mark",,1st ed,1984,,,144,
HGNXK2MM,"John Chamberlain: a catalogue raisonné of the sculpture, 1954-1985",Books,"Sylvester, Julie; Chamberlain, John; Museum of Contemporary Art (Los Angeles, Calif.)",0-933920-57-1,,1986,Hudson Hills Press,,Artist-C,New York,"Abstract expressionism; Catalogues raisonnés; Chamberlain, John; United States",,1st ed,1986,,,239,
7HZQC55R,"""Success is a job in New York-- "": the early art and business of Andy Warhol",Books,"Warhol, Andy; De Salvo, Donna M.; Carnegie Museum of Art; Grey Art Gallery & Study Center; Universit",0-934349-05-3,,1989,"Grey Art Gallery and Study Center, New York University ; Carnegie Museum of Art",,ARTIST - W,"[New York, N.Y.] : Pittsburgh, Pa","Exhibitions; Biography; United States; Artists; Warhol, Andy",,,1989,,,89,
UYN9T4EC,In the shadow of the Acropolis: popular and private art of 4th century Athens,Books,"Herrmann, John J.; Brockton Art Museum; Museum of Fine Arts, Boston",0-934358-13-3,,1984,Brockton Art Museum/Fuller Memorial,,ANCIENT - PERIODICAL,"Brockton, Mass","Exhibitions; Art, Ancient; Greece Athens; Art, Greek; Coins, Ancient; Department of Classical Art; Museum of Fine Arts, Boston",,,1984,,,87,
NS9W7ZTG,Julie Mehretu: drawing into painting,Books,"Mehretu, Julie; Fogle, Douglas; Walker Art Center",0-935640-74-6,,2003,Walker Art Center,,ARTIST - M,"Minneapolis, Minn","Exhibitions; Themes, motives; Mehretu, Julie",,1st ed,2003,,,16,
ZZS3LVVQ,Worlds away: new suburban landscapes,Books,0,0-935640-90-8,,2008,Walker Art Center,,ARCHITECTURE,Minneapolis,"Exhibitions; 20th century; Art, American; 21st century; Suburban life in art; Suburbs in art",,1st ed,2008,,,333,
CAIC5H8K,Bill Viola: survey of a decade,Books,"Viola, Bill; Boyle, Deirdre; Zeitlin, Marilyn; Contemporary Arts Museum",0-936080-18-3,,1988,Contemporary Arts Museum,,ARTIST - V,Houston,"Exhibitions; United States; Installations (Art); Video art; Viola, Bill",,,1988,,,64,
NZXDKHQF,"Brice Marden: work of the 1990s: paintings, drawings, and prints",Books,"Wylie, Charles; Marden, Brice; Dallas Museum of Art",0-936227-25-7,,1998,Dallas Museum of Art in association with Distributed Art Publishers,,Artist M,"Dallas, TX","Exhibitions; Marden, Brice",,,1998,,,79,
N2KAIG2S,Joslyn Art Museum: ancient Greek pottery,Books,0,0-936364-15-7,,1985,The Museum,,ANCIENT,"Omaha, Neb","Exhibitions; Greece; Joslyn Art Museum; Pottery, Ancient; Pottery, Greek",,,1985,,,94,
QRDW8J6R,"Rodin and America: influence and adapation, 1876-1936",Books,0,0-937031-36-4,,2011,"Iris & B. Gerald Cantor Center for Visual Arts, Stanford University ; Silvana Editoriale",,ARTIST - R,"Stanford, CA : Milano, Italy","19th century; Exhibitions; 20th century; United States; Rodin, Auguste; Appreciation; Art, American",,,2011,,,381,
3ZA76GCF,Dialogues: conversations with European artists at mid-century,Books,"Roditi, Edouard; Roditi, Edouard; Roditi, Edouard",0-938491-26-1,,1990,Bedford Arts,,MODERN,San Francisco,"20th century; Artists; Interviews; Europe; Art, European",,,1990,,,156,
87URGULF,"The Kiss of Apollo: photography & sculpture, 1845 to the present",Books,0,0-938491-66-0,,1991,Fraenkel Gallery in association with Bedford Arts Publishers,,PHOTOGRAPHY,San Francisco,Photography of sculpture,,1st ed,1991,,,105,
W7FJ5PMG,"Warren MacKenzie, potter: a retrospective",Books,0,0-938713-05-1,,1989,"University Art Museum, University of Minnesota",,Artist M,Minneapolis,"Exhibitions; Influence Exhibitions; MacKenzie, Warren",,,1989,,,128,
Y96FY988,"Drawings from Georgia collections, 19th & 20th century",Books,"Morrin, Peter; Zafran, Eric; High Museum of Art",0-939802-00-7,,1981,High Museum of Art,,MODERN,"Atlanta, Ga",Drawing; 19th century; Exhibitions; 20th century; Georgia,,,1981,,,214,
ST7JLNCI,"The Advent of modernism: post-impressionism and North American art, 1900-1918",Books,0,0-939802-24-4,,1986,High Museum of Art,,MODERN,Atlanta,"Exhibitions; Post-impressionism (Art); 20th century; Painting, American; United States; Canada; Painting, Canadian",,,1986,,,200,
WERBZDCF,"Sean Scully: Twenty Years, 1976-1995",Books,"Rifkin, Ned",0-939802-79-1,,1995,High Museum of Art,,ARTIST - S,,0,,,1995,,,,
3ZHP4KXD,From the Lands of the Scythians: Ancient Treasures from the Museum of the USSR 3000 B.C. -100 B.C,Books,0,0-942389-04-2,,,Metropolitan Museum of Art,,ANCIENT,,0,,,,,,,
C5G6YNUR,Drawings from the Holy Roman Empire 1540-1680: A Selection from North American Collections,Books,"Kaufmann, Thomas DeCosta",0-943012-02-3,,1982,"The Art Museum, Princeton University",,RENAISSANCE - BAROQUE,,0,,,1982,,,,
3QSBPHKB,Beyond Isabella: secular women patrons of art in Renaissance Italy,Books,0,0-943549-78-7,,2001,Truman State University Press,,RENAISSANCE,"Kirksville, Mo","Art, Renaissance; History; Italy; Art patronage; Art, Italian; Women art patrons",Sixteenth century essays & studies series,,2001,,,339,
UN8SI9Q3,Common ground/uncommon vision: the Michael and Julie Hall collection of American folk art in the Milwaukee Art Museum,Books,0,0-944110-33-9,,1993,The Museum,,AMERICAN,Milwaukee,"Exhibitions; United States; Art collections; Private collections; Wisconsin Madison; Folk art; Hall, Julie; Hall, Michael D; Milwaukee Art Museum",,,1993,,,335,
2IJ6NWD8,Arena: where would I have got if I had been intelligent!,Books,"Beuys, Joseph; Cooke, Lynne; Kelly, Karen; Dia Center for the Arts (New York, N.Y.)",0-944521-29-0,,1994,Dia Center for the Arts : Distributed Art Publishers,,ARTIST-B,New York,"Beuys, Joseph; Catalogs; Dia Center for the Arts (New York, N.Y.)",,,1994,,,294,
CAQ8M4E9,Africa explores: 20th century African art,Books,"Vogel, Susan Mullin; Center for African Art (New York, N.Y.)",0-945802-09-9,,1991,Center for African Art ; Prestel-Verlag ; Distributed in the U.S. of America and Canada by Neues Pub. Co,,AFRICAN,New York : Munich : New York City,"Exhibitions; 20th century; Art, African",,,1991,,,294,
